partner,course,skills,rating,reviewcount,level,certificatetype,duration,crediteligibility
University of California Irvine,Career Success,"[Leadership and Management, Professional Development, Strategy and Operations, Business Communication, Adaptability, Business Analysis, Communication, Decision Making, Project Management, People Management, Critical Thinking, Collaboration, Customer Relationship Management, Strategy, Planning, Business Development, Problem Solving, Accounting, Change Management, Conflict Management, Financial Accounting, Leadership Development, Entrepreneurship, People Development, Business Research, Cost Accounting, Deep Learning, Finance, Financial Management, General Accounting, Generally Accepted Accounting Principles (GAAP), Negotiation, Financial Analysis, Writing, Benefits, Contract Management, Entrepreneurial Finance, Data Visualization Software, Marketing, Scrum (Software Development), User Experience, Estimation]",46,413000,Beginner , Specialization , 3 - 6 Months,false
University of Pennsylvania,AI Fundamentals for Non-Data Scientists,"[Machine Learning, Machine Learning Algorithms, Artificial Neural Networks, Data Analysis, Deep Learning, Human Learning, Big Data]",48,210,Mixed , Course , 1 - 4 Weeks,false
University of Pennsylvania,Intellectual Property Law,"[Critical Thinking, Strategy, Innovation, Brand Management, Leadership and Management, Marketing, Strategy and Operations, Design and Product]",48,12000,Intermediate , Specialization , 3 - 6 Months,false
University of Pennsylvania,Fundamentals of Quantitative Modeling,"[Business Analysis, Data Model, Finance, Forecasting, General Statistics, Mathematical Theory & Analysis, Probability & Statistics, Regression, Statistical Analysis, Linear Algebra]",46,86000,Mixed , Course , 1 - 4 Weeks,false
University of Amsterdam,Methods and Statistics in Social Sciences,"[Probability & Statistics, Statistical Tests, General Statistics, Statistical Analysis, Correlation And Dependence, Statistical Programming, Basic Descriptive Statistics, Research and Design, Data Analysis, Regression, Adaptability, Computational Thinking, Critical Thinking, People Analysis, Theoretical Computer Science, Writing, Probability Distribution, Problem Solving, R Programming, Experiment, Mathematical Theory & Analysis, Computer Programming]",46,73000,Beginner , Specialization , 3 - 6 Months,false
University of Virginia,Pricing Strategy Optimization,"[Marketing, Strategy, Strategy and Operations, Customer Analysis, Sales, Product Strategy, Business Analysis, Leadership and Management, Market Analysis, Product Marketing, Design and Product, Product Management, Entrepreneurship, Market Research, Accounting, Decision Making, Game Theory, B2B Sales, Cost Accounting, Data Analysis, Product Lifecycle, Marketing Management, Retail Sales]",48,864,Beginner , Specialization , 3 - 6 Months,false
The Museum of Modern Art,Modern and Contemporary Art and Design,"[Design and Product, Critical Thinking, Creativity]",48,141000,Beginner , Specialization , 3 - 6 Months,false
University of California Davis,The Strategy of Content Marketing,"[Digital Marketing, Marketing, Writing, Strategy]",45,43000,Intermediate , Course , 1 - 3 Months,false
Stanford University,Introduction to Healthcare,"[(780 reviews)]",48,780,Beginner , Course , 1 - 3 Months,false
Google,Capstone: Applying Project Management in the Real World,"[Communication, Leadership and Management, Planning, Problem Solving, Project Management]",48,68000,Beginner , Course , 1 - 4 Weeks,false
Duke University,Java Programming and Software Engineering Fundamentals,"[Computer Programming, Java Programming, Programming Principles, Algorithms, Problem Solving, Data Structures, Software Engineering, Computer Programming Tools, Critical Thinking, Computational Thinking, Data Analysis, Javascript, Software Testing, Front-End Web Development, HTML and CSS, Web Design, Web Development, Web Development Tools, Computer Graphic Techniques, Software Architecture, Data Model, Cryptography, Data Analysis Software, Statistical Programming, Strategy]",46,215000,Beginner , Specialization , 3 - 6 Months,false
DeepLearningAI,Natural Language Processing with Classification and Vector Spaces,"[Machine Learning, Natural Language Processing, Probability & Statistics, Python Programming, Machine Learning Algorithms, Applied Machine Learning, Computer Programming, Human Learning, Mathematics, Statistical Machine Learning]",46,41000,Intermediate , Course , 1 - 4 Weeks,false
IBM,Introduction to Cybersecurity Tools & Cyber Attacks,"[Cryptography, Security Software, Cyberattacks, Leadership and Management]",46,147000,Beginner , Course , 1 - 4 Weeks,false
University of London,Brand Management: Aligning Business Brand and Behaviour,"[Brand Management, Leadership and Management, Marketing]",49,7000,Beginner , Course , 1 - 3 Months,false
Google Cloud,Machine Learning on Google Cloud,"[Machine Learning, Applied Machine Learning, Google Cloud Platform, Human Learning, Machine Learning Software, Cloud Computing, Machine Learning Algorithms, Deep Learning, Cloud Platforms, Artificial Neural Networks, Feature Engineering, Exploratory Data Analysis, Tensorflow, Python Programming, Data Analysis, Data Visualization, Probability & Statistics, Regression, Statistical Programming, Statistical Visualization, Algorithms, SQL, Cloud API, Apache, Extract, Transform, Load]",45,95000,Intermediate , Specialization , 3 - 6 Months,false
University of Pennsylvania,Removing Barriers to Change,"[Business Psychology, Change Management, Leadership and Management, Problem Solving, Strategy, Behavioral Economics, Influencing, Marketing, Organizational Development, Strategy and Operations]",49,373,Beginner , Course , 1 - 4 Weeks,false
Google Cloud,Google Cloud Digital Leader Training,"[Cloud Computing, Cloud Infrastructure, Google Cloud Platform, Cloud Management, Cloud Platforms, Cloud Applications, Cloud-Based Integration, Cloud Clients, Kubernetes, Other Cloud Platforms and Tools, Data Management, DevOps, Software Engineering Tools, System Security, Data Architecture, Google App Engine, Account Management, Collaboration, Innovation, Leadership and Management, Operations Management, Data Warehousing, Machine Learning]",48,37000,Beginner , Professional Certificate , 3 - 6 Months,false
SAS,SAS Programmer,"[SAS (Software), Data Analysis, Statistical Programming, Data Analysis Software, Computer Programming, Statistical Analysis, Programming Principles, Data Management, Data Structures, Exploratory Data Analysis, Databases, SQL, Problem Solving, Process Analysis, Computer Programming Tools, Computational Logic]",48,33000,Beginner , Professional Certificate , 3 - 6 Months,true
Emory University,Management Consulting,"[Leadership and Management, Business Communication, Critical Thinking, Problem Solving, Decision Making, Strategy, Business Development, Business Intelligence, Communication, Market Research, Data Analysis, People Analysis, People Management, Process Analysis, Project Management, Strategy and Operations, Data Management]",48,546,Beginner , Specialization , 3 - 6 Months,false
Macquarie University,Excel Skills for Data Analytics and Visualization,"[Business Analysis, Spreadsheet Software, Data Analysis, Data Management, Data Visualization, Microsoft Excel, Data Analysis Software, Exploratory Data Analysis, Statistical Visualization, Data Model, Data Structures, Data Visualization Software, Database Design, Plot (Graphics), Visual Design, Big Data, Power BI, Leadership and Management]",48,47000,Intermediate , Specialization , 3 - 6 Months,false
Vanderbilt University,MATLAB Programming for Engineers and Scientists,"[Computer Programming, Other Programming Languages, Matlab, Data Analysis, Algorithms, Theoretical Computer Science, Data Visualization, Mathematics, Plot (Graphics), Visualization (Computer Graphics), Computer Graphics, Statistical Machine Learning, Data Analysis Software, Problem Solving, Programming Principles]",48,176000,Beginner , Specialization , 3 - 6 Months,false
Yale University,Managing Emotions in Times of Uncertainty & Stress,"[Emotional Intelligence]",48,27000,Beginner , Course , 1 - 3 Months,false
University of Illinois at Urbana-Champaign,Strategic Leadership and Management,"[Leadership and Management, Strategy and Operations, Strategy, Leadership Development, Decision Making, Entrepreneurship, Organizational Development, Business Analysis, Business Process Management, Change Management, Business Design, Business Development, Business Transformation, Communication, Critical Thinking, Culture, Performance Management, Problem Solving, Human Resources, Marketing, Operational Analysis, Sales, Adaptability, Conflict Management, Influencing, Negotiation, People Development, Business Psychology, Market Analysis, Product Strategy, Research and Design]",48,88000,Beginner , Specialization , 3 - 6 Months,true
University of Alberta,Software Design and Architecture,"[Software Architecture, Software Engineering, Systems Design, Programming Principles, Computer Programming, System Software, Application Development, Computer Architecture, Design and Product, Java Programming, Product Design, Software Engineering Tools, Problem Solving, Computational Thinking, Project Management, Data Visualization, System Programming]",46,36000,Beginner , Specialization , 3 - 6 Months,false
University of Colorado Boulder,Effective Communication: Writing Design and Presentation,"[Communication, Writing, Creativity, Business Design, Computer Graphics, Design and Product, Graphic Design, Interactive Design, Marketing Design, Visual Design, Visualization (Computer Graphics), Business Communication, Professional Development, Critical Thinking, Leadership and Management, Decision Making, Natural Language Processing, Strategy, Reinforcement Learning, Emotional Intelligence]",48,109000,Beginner , Specialization , 3 - 6 Months,false
SkillUp EdTech,Scrum Master,"[Project Management, Scrum (Software Development)]",47,73,Beginner , Specialization , 3 - 6 Months,false
EDHEC Business School,Investment Management with Python and Machine Learning,"[Investment Management, Python Programming, Finance, Data Analysis, Computer Programming, Machine Learning, Statistical Programming, Applied Machine Learning, Financial Analysis, Machine Learning Algorithms, Risk Management, Statistical Machine Learning, Data Analysis Software, Data Management, Data Mining, Natural Language Processing, Algorithms, Human Learning, Big Data, Leadership and Management, Computer Science]",46,17000,Beginner , Specialization , 3 - 6 Months,false
University of California Irvine,Academic English: Writing,"[Writing]",47,22000,Beginner , Specialization , 3 - 6 Months,false
ISC2,(ISC)² Systems Security Certified Practitioner (SSCP),"[Security Engineering, System Security, Network Security, Software Security, Computer Security Incident Management, Leadership and Management, Security Software, Risk Management, Strategy and Operations, Algorithms, Cloud Computing, Cryptography, Cyberattacks, Operations Management, Human Factors (Security), Software-Defined Networking, Cloud Applications, Network Analysis, Communication, Financial Accounting]",47,501,Beginner , Specialization , 3 - 6 Months,false
University of Virginia,Agile Development,"[Agile Software Development, Design and Product, Leadership and Management, Product Management, Software Engineering, Product Development, Project Management, User Experience, Customer Analysis, Product Design, Research and Design, Data Analysis, Business Analysis, Communication, Continuous Delivery, Probability Distribution]",47,45000,Beginner , Specialization , 3 - 6 Months,false
Meta,Introduction to Social Media Marketing,"[Communication, Marketing, Digital Marketing, Social Media, Media Strategy & Planning, Advertising, Entrepreneurship, Marketing Management]",48,125000,Beginner , Course , 1 - 3 Months,false
University of California Irvine,Introduction to Business,"[Marketing, Strategy and Operations, Accounting, Digital Marketing, Entrepreneurship, Finance, Financial Management, Leadership and Management, Financial Accounting, Financial Analysis, General Accounting, People Management, Planning, Sales, Strategy, Supply Chain and Logistics, Search Engine Optimization, Storytelling]",47,242,Beginner , Specialization , 1 - 3 Months,false
DeepLearningAI,Introduction to TensorFlow for Artificial Intelligence Machine Learning and Deep Learning,"[Machine Learning, Tensorflow, Artificial Neural Networks, Computer Programming, Machine Learning Algorithms, Deep Learning, Machine Learning Software, Applied Machine Learning, Human Learning, Algorithms, Computer Vision]",48,19000,Intermediate , Course , 1 - 4 Weeks,false
The University of Sydney,Introduction to Calculus,"[Algebra, Calculus, Mathematical Theory & Analysis, Mathematics, Problem Solving, Computational Logic, Critical Thinking, Differential Equations, Plot (Graphics), Geometry]",48,34000,Intermediate , Course , 1 - 3 Months,false
Microsoft,Microsoft Azure Data Scientist Associate (DP-100),"[Machine Learning, Microsoft Azure, Applied Machine Learning, Machine Learning Algorithms, Machine Learning Software, Cloud Computing, Python Programming, Human Learning, Algorithms, Big Data, Cloud Applications, Data Analysis, Regression, Cloud-Based Integration, Extract, Transform, Load, Training, Exploratory Data Analysis, Cloud Platforms, Data Management, Deep Learning, Experiment]",44,284,Intermediate , Professional Certificate , 3 - 6 Months,false
University of California San Diego,Introduction to Discrete Mathematics for Computer Science,"[Mathematics, Problem Solving, Mathematical Theory & Analysis, Algorithms, Critical Thinking, Graph Theory, Combinatorics, Computational Thinking, Probability & Statistics, Computer Programming, Python Programming, Computational Logic, General Statistics, Theoretical Computer Science, Probability Distribution, Strategy, Creativity, Experiment, Calculus, Game Theory, Visualization (Computer Graphics), Plot (Graphics), Cryptography, Sales]",45,34000,Beginner , Specialization , 3 - 6 Months,false
University of California Irvine,Project Launch,"[Leadership and Management, Project Management]",47,238,Beginner , Course , 1 - 3 Months,false
IBM,Machine Learning with Python,"[Machine Learning, Algorithms, Applied Machine Learning, Customer Analysis, Data Analysis, Decision Making, Human Learning, Machine Learning Algorithms, Python Programming, Statistical Machine Learning, Regression]",47,148000,Intermediate , Course , 1 - 3 Months,false
IBM,Databases and SQL for Data Science with Python,"[Python Programming, Computational Thinking, Computer Programming, Data Analysis, Data Management, Database Application, Database Design, Database Theory, Databases, SQL, Cloud Computing, IBM Cloud]",46,186000,Beginner , Course , 1 - 3 Months,false
The University of Chicago,Understanding the Brain: The Neurobiology of Everyday Life,"[(27k reviews)]",49,27000,Beginner , Course , 1 - 3 Months,false
University System of Georgia,Six Sigma Yellow Belt,"[Process Analysis, Strategy and Operations, Leadership and Management, Data Analysis, Business Analysis, Business Process Management, Performance Management, Probability & Statistics, Operational Analysis, Organizational Development, Problem Solving, Project Management, General Statistics, Planning, Statistical Tests, Critical Thinking, Operations Management, Statistical Visualization, Correlation And Dependence, Customer Relationship Management, Collaboration, Entrepreneurship, People Development, Risk Management, Business Psychology, Communication]",46,89000,Beginner , Specialization , 3 - 6 Months,false
University of California San Diego,Drug Development Product Management,"[Strategy, Marketing]",46,58000,Beginner , Specialization , 3 - 6 Months,false
Google,Get Started with Python,"[Computer Programming, Data Analysis, Python Programming]",48,650,Advanced , Course , 1 - 3 Months,false
ESSEC Business School,Diversity and inclusion in the workplace,"[Human Resources, Leadership and Management, Organizational Development, Change Management, Critical Thinking, Employee Relations, People Analysis, Professional Development, Talent Management, Continuous Integration, Training]",47,906,Beginner , Course , 1 - 4 Weeks,false
University of Illinois at Urbana-Champaign,Business Data Management and Communication,"[Business Analysis, Accounting, Data Management, General Accounting, Account Management, Data Analysis, Finance, Financial Accounting, Financial Management, Leadership and Management, Accounts Payable and Receivable, Financial Analysis, Generally Accepted Accounting Principles (GAAP), Management Accounting, Business Intelligence, Cost Accounting, R Programming, Communication, Data Visualization, Interactive Data Visualization, Statistical Programming, Big Data, Data Visualization Software, Visual Design, Visualization (Computer Graphics), Creativity, Plot (Graphics), Computer Programming, Innovation, Strategy]",47,58000,Intermediate , Specialization , 3 - 6 Months,true
Google,Put It to Work: Prepare for Cybersecurity Jobs,"[Computer Programming, Python Programming, SQL]",49,952,Beginner , Course , 1 - 3 Months,false
IE Business School,Branding: The Creative Journey,"[Brand Management, Marketing, Leadership and Management, Advertising, Communication, Strategy, Creativity, Strategy and Operations, Digital Marketing, User Experience, Customer Analysis, Design and Product, Media Strategy & Planning, Customer Relationship Management, Customer Success, Customer Support, Social Media, Storytelling, User Experience Design, Visual Design, Graphic Design, Journalism]",46,14000,Beginner , Specialization , 3 - 6 Months,false
Advancing Women in Tech,Real-World Product Management,"[Leadership and Management, Product Strategy, Product Management, Strategy, Marketing, Strategy and Operations, Product Marketing, Business Development, Business Process Management, Market Analysis]",45,795,Beginner , Specialization , 3 - 6 Months,true
University of Pennsylvania,Introduction to Financial Accounting,"[Accounting, Accounts Payable and Receivable, Finance, Financial Accounting, General Accounting, Generally Accepted Accounting Principles (GAAP), Account Management, Cash Management, Cost Accounting, Financial Analysis]",47,79000,Mixed , Course , 1 - 4 Weeks,false
Johns Hopkins University,Introduction to Systematic Review and Meta-Analysis,"[(32k reviews)]",48,32000,Mixed , Course , 1 - 3 Months,false
Google,Google Project Management (DE),"[Design and Product, Microsoft Excel, Software Engineering, Leadership and Management, Business Analysis, Business Design, Data Analysis, Marketing Design, Creativity, Persona Research, Customer Analysis]",42,51,Beginner , Professional Certificate , 3 - 6 Months,false
New York Institute of Finance,Risk Management,"[Leadership and Management, Risk Management, Finance, Probability & Statistics, Strategy, Financial Analysis, Strategy and Operations, Operations Management, Statistical Tests, Business Analysis, Business Process Management, Operational Analysis, Market Analysis, Financial Management, Statistical Analysis, Critical Thinking, Regulations and Compliance, Banking, General Statistics, Operating Systems, Data Analysis, Probability Distribution]",46,668,Beginner , Specialization , 3 - 6 Months,false
University of Maryland College Park, Cybersecurity for Everyone,"[Cyberattacks, Human Computer Interaction, Network Security, Security Engineering, Security Strategy, Computer Security Models, Leadership and Management, Risk Management, Software Security, Critical Thinking]",47,11000,Beginner , Course , 1 - 3 Months,false
Atlassian,Agile with Atlassian Jira,"[Agile Software Development, Leadership and Management, Planning, Product Development, Product Management, Project Management, Scrum (Software Development), Software Engineering, Software Testing, Technical Product Management, Jira (Software)]",47,83000,Beginner , Course , 1 - 4 Weeks,false
DeepLearningAI,Structuring Machine Learning Projects,"[Applied Machine Learning, Data Analysis, Deep Learning, Exploratory Data Analysis, Machine Learning, Machine Learning Algorithms, Organizational Development, Strategy, Artificial Neural Networks, Computer Vision, Human Learning]",48,495000,Beginner , Course , 1 - 4 Weeks,false
University of Geneva,Investment Management,"[Finance, Investment Management, Leadership and Management, Financial Analysis, Risk Management, Financial Management, Market Analysis, Strategy, Decision Making, Behavioral Economics, Strategy and Operations, Correlation And Dependence, Market Research, Performance Management, Probability & Statistics, Securities Trading, Mathematical Theory & Analysis, Statistical Analysis, Accounting]",47,72000,Beginner , Specialization , 3 - 6 Months,false
Google,Google Data Analytics Capstone: Complete a Case Study,"[Business Analysis, Computer Programming, Data Analysis, Exploratory Data Analysis, R Programming, SQL, Spreadsheet Software, Statistical Programming, Tableau Software]",48,126000,Beginner , Course , 1 - 4 Weeks,false
IBM ,IBM Mainframe Developer,"[Computer Programming, Other Programming Languages, Software Engineering, Theoretical Computer Science, Computer Architecture]",46,936,Intermediate , Professional Certificate , 3 - 6 Months,false
University of Pennsylvania,Introduction to Marketing,"[Brand Management, Customer Analysis, Market Analysis, Marketing, Marketing Design, Product Marketing, Product Strategy, Strategy, Customer Relationship Management, Digital Marketing, Communication]",48,125000,Mixed , Course , 1 - 3 Months,false
University of Colorado Boulder,Software Architecture for Big Data,"[Big Data, Software Engineering]",33,33,Advanced , Specialization , 1 - 3 Months,true
LearnQuest,ITIL 4 Exam Preparation,"[Organizational Development, Leadership and Management]",47,942,Mixed , Course , 1 - 3 Months,false
IBM,Introduction to Project Management,"[Leadership and Management, Project Management]",48,370,Beginner , Course , 1 - 3 Months,false
DeepLearningAI,Convolutional Neural Networks,"[Artificial Neural Networks, Computer Vision, Machine Learning, Applied Machine Learning, Deep Learning, Machine Learning Software, Machine Learning Algorithms, Network Model, Tensorflow, Network Architecture, Human Learning]",49,418000,Intermediate , Course , 1 - 4 Weeks,false
Duke University,Medical Neuroscience,"[Health]",49,27000,Advanced , Course , 3 - 6 Months,false
University of Michigan,Web Design for Everybody: Basics of Web Development & Coding,"[Front-End Web Development, HTML and CSS, Web Design, Web Development, Web Development Tools, Computer Programming, Semantic Web, User Experience Design, Full-Stack Web Development, Interactive Design, Programming Principles, Computer Programming Tools, Javascript, Other Web Frameworks, Visual Design, Computational Logic, Design and Product]",47,341000,Beginner , Specialization , 3 - 6 Months,false
University of London,Global Diplomacy - Diplomacy in the Modern World,"[Critical Thinking, Negotiation]",47,46000,Mixed , Course , 1 - 3 Months,false
Google,Google IT Support,"[]",0,0,,0,0,false
Google,Conduct UX Research and Test Early Concepts,"[Planning, User Experience, User Research]",48,45000,Beginner , Course , 1 - 4 Weeks,false
University of California Davis,Data Visualization with Tableau,"[Data Visualization, Data Analysis, Data Analysis Software, Data Visualization Software, Tableau Software, Business Analysis, Business Intelligence, Statistical Visualization, Exploratory Data Analysis, Interactive Data Visualization, Interactive Design, Software Visualization, Storytelling, Visual Design, Visualization (Computer Graphics), Plot (Graphics), Computer Graphics]",45,78000,Beginner , Specialization , 3 - 6 Months,false
Stanford University,Introduction to Mathematical Thinking,"[Critical Thinking, Mathematical Theory & Analysis, Mathematics, Problem Solving, Computational Logic, Algebra, Applied Mathematics, Data Analysis, Algorithms, Computational Thinking]",48,26000,Intermediate , Course , 1 - 3 Months,false
Rutgers the State University of New Jersey,Global Procurement and Sourcing,"[Procurement, Customer Relationship Management, Leadership and Management, Negotiation]",47,19000,Beginner , Specialization , 3 - 6 Months,false
University System of Georgia,Six Sigma Black Belt,"[Leadership and Management, Organizational Development, Strategy and Operations, General Statistics, Probability & Statistics, Operations Management, Process Analysis, Statistical Analysis, Business Analysis, Data Analysis, Project Management, Business Process Management, Performance Management, Basic Descriptive Statistics, Entrepreneurship, Statistical Tests, Problem Solving, Probability Distribution, Statistical Visualization, Strategy, Decision Making, Leadership Development, Planning, Correlation And Dependence, People Management, Communication, Customer Analysis, Marketing, Sales, Supply Chain and Logistics, Collaboration, Conflict Management, Customer Success, Experiment]",45,453,Intermediate , Specialization , 3 - 6 Months,false
IBM ,IBM z/OS Mainframe Practitioner,"[Operating Systems, System Programming, Computer Programming, Computer Programming Tools, Computer Architecture, Data Management, Theoretical Computer Science, Databases, Operations Management, Software-Defined Networking, User Experience]",47,11000,Intermediate , Professional Certificate , 1 - 3 Months,false
Microsoft,Preparing  Data for Analysis with Microsoft Excel,"[Data Analysis, Microsoft Excel, Power BI]",47,687,Beginner , Course , 1 - 4 Weeks,false
University of Michigan,Python Basics,"[Computer Programming, Python Programming, Problem Solving]",48,169000,Beginner , Course , 1 - 4 Weeks,false
