partner,course,skills,rating,reviewcount,level,certificatetype,duration,crediteligibility
University of California San Diego,Object Oriented Java Programming: Data Structures and Beyond,"[Computer Programming, Java Programming, Data Structures, Algorithms, Problem Solving, Programming Principles, Critical Thinking, Software Engineering, Computational Thinking, Communication, Computer Programming Tools, Data Analysis, Theoretical Computer Science, Computational Logic, Computer Graphics, Visualization (Computer Graphics), Recruitment, Training, People Analysis]",47,71000,Intermediate , Specialization , 3 - 6 Months,false
University of Michigan,Python Classes and Inheritance,"[Computer Programming, Python Programming]",47,35000,Intermediate , Course , 1 - 4 Weeks,false
University of Arizona,Astronomy: Exploring Time and Space,"[(35k reviews)]",48,35000,Beginner , Course , 1 - 3 Months,false
Microsoft,Microsoft Azure Security Engineer Associate (AZ-500),"[(11 reviews)]",48,11,Intermediate , Professional Certificate , 3 - 6 Months,false
American Museum of Natural History,Marine Biology,"[(83 reviews)]",47,83,Beginner , Course , 1 - 3 Months,false
University of Colorado System,Inclusive Leadership: The Power of Workplace Diversity,"[Collaboration, Communication, Leadership Development, Leadership and Management, Culture, Emotional Intelligence]",49,17000,Beginner , Course , 1 - 4 Weeks,false
Emory University,Qualitative Research Design and Methods for Public Health,"[Data Analysis]",47,165,Beginner , Specialization , 3 - 6 Months,false
Wesleyan University,Suicide Prevention,"[(159 reviews)]",46,159,Beginner , Course , 1 - 4 Weeks,false
Google,Regression Analysis: Simplify Complex Data Relationships,"[Python Programming, Regression, Statistical Analysis]",47,181,Advanced , Course , 1 - 3 Months,false
Utrecht University,Understanding child development: from synapse to society,"[Critical Thinking]",46,259,Beginner , Course , 1 - 3 Months,false
Yale University,Narrative Economics,"[Storytelling]",48,341,Beginner , Course , 1 - 4 Weeks,false
Copenhagen Business School,Digital Transformation in Financial Services,"[FinTech, Finance, Innovation, Banking, Business Transformation, Leadership and Management, Payments, Regulations and Compliance, Strategy, Strategy and Operations, BlockChain, Business Analysis, Cash Management, Cross Platform Development, Decision Making, Entrepreneurship, Network Architecture, Research and Design, Risk Management]",44,19000,Beginner , Specialization , 3 - 6 Months,false
Johns Hopkins University,Data Literacy,"[General Statistics, Data Analysis, Probability & Statistics, Statistical Analysis, Research and Design, Statistical Tests, Basic Descriptive Statistics, Regression, Data Visualization, Exploratory Data Analysis]",46,206,Beginner , Specialization , 3 - 6 Months,false
IBM,Building AI Powered Chatbots Without Programming,"[Cloud Computing, Computer Programming, IBM Cloud, Machine Learning]",48,25000,Beginner , Course , 1 - 3 Months,false
Google Cloud,From Data to Insights with Google Cloud,"[Google Cloud Platform, Cloud Computing, SQL, Databases, Data Analysis, Big Data, Cloud Platforms, Data Management, Exploratory Data Analysis, Cloud Storage, Data Analysis Software, Machine Learning, Applied Machine Learning, Human Learning, Data Visualization, Machine Learning Algorithms, Machine Learning Software, Database Theory]",46,46000,Beginner , Specialization , 3 - 6 Months,false
Johns Hopkins University,Patient Safety,"[Communication, Problem Solving, Planning]",48,16000,Beginner , Specialization , 3 - 6 Months,false
University of Illinois at Urbana-Champaign,Microeconomics Principles,"[Behavioral Economics, Decision Making, Market Research, Market Analysis, Strategy, Problem Solving, Cost Accounting, Data Analysis, Strategy and Operations]",48,29000,Beginner , Course , 1 - 3 Months,false
Pontificia Universidad Católica de Chile,Introducción a la programación en Python I: Aprendiendo a programar con Python,"[Computational Logic, Computer Programming, Programming Principles, Python Programming, Algorithms, Data Analysis, Computer Programming Tools, Computational Thinking, System Programming, Problem Solving]",44,42000,Beginner , Course , 1 - 3 Months,false
University of California Davis,Introduction to Google SEO,"[Critical Thinking, Digital Marketing, Marketing, Search Engine Optimization, Social Media, User Experience, User Research, Web Development Tools, Algorithms, Customer Analysis, Media Strategy & Planning, Strategy]",46,97000,Beginner , Course , 1 - 4 Weeks,false
University of Glasgow ,Diversity and Inclusion in Education,"[Leadership and Management]",48,178,Intermediate , Course , 1 - 4 Weeks,false
Novartis,Introduction to Good Clinical Practice,"[(40 reviews)]",46,40,Beginner , Course , 1 - 4 Weeks,false
Microsoft,Microsoft Power Platform Fundamentals,"[Business Analysis, Business Intelligence, Cloud Applications, Interactive Data Visualization, Application Development, Business Development, Data Model, Design and Product, Power BI, Software As A Service, User Experience Design, Data Analysis]",42,101,Beginner , Course , 1 - 3 Months,false
IBM,Introduction to Technical Support,"[Customer Success, Strategy and Operations, Communication, Customer Support, Information Technology]",48,598,Beginner , Course , 1 - 3 Months,false
Imperial College London,Immunology: The Immune System and its Failures,"[(123 reviews)]",47,123,Intermediate , Specialization , 3 - 6 Months,false
Indian School of Business,Trading Strategies in Emerging Markets,"[Finance, Investment Management, Financial Analysis, Securities Trading, Accounting, Algorithms, Strategy, Financial Accounting, Market Analysis, Business Analysis, Statistical Analysis, Strategy and Operations, Account Management, Accounts Payable and Receivable, General Accounting, Market Research, Performance Management, Cash Management, Correlation And Dependence, Critical Thinking]",42,26000,Beginner , Specialization , 3 - 6 Months,false
IBM,IBM Data Analyst,"[]",0,0,,0,0,false
IBM,Deep Neural Networks with PyTorch,"[Human Learning, Machine Learning, Deep Learning, Python Programming, Artificial Neural Networks, Machine Learning Algorithms, Applied Machine Learning, Algorithms, Regression, Statistical Machine Learning]",44,15000,Intermediate , Course , 1 - 3 Months,false
Google Cloud,Preparing for Google Cloud Certification: Cloud Data Engineer Professional Certificate 日本語版,"[Google Cloud Platform, Data Management, Databases, Big Data, Computer Networking, Cloud Computing, SQL, Machine Learning, Cloud Platforms, Data Warehousing, Cloud Storage, Machine Learning Software, Data Analysis Software, Tensorflow]",44,295,Intermediate , Professional Certificate , 3 - 6 Months,false
Google Cloud,Data Engineering Big Data and ML on Google Cloud 日本語版,"[Google Cloud Platform, Computer Networking, Data Management, Databases, Big Data, Cloud Computing, SQL, Cloud Platforms, Machine Learning, Cloud Storage, Data Warehousing, Machine Learning Software, Data Analysis Software, Tensorflow]",44,288,Intermediate , Specialization , 3 - 6 Months,false
Johns Hopkins University,Executive Data Science,"[Data Analysis, Exploratory Data Analysis, Probability & Statistics, Data Management, Critical Thinking, General Statistics, Leadership and Management, Data Model, Decision Making, Experiment, Statistical Analysis, Data Analysis Software, Machine Learning, Correlation And Dependence, Machine Learning Algorithms, Statistical Tests, Strategy and Operations, Human Resources, Talent Management, Communication, Human Learning, Organizational Development, People Management]",45,108000,Beginner , Specialization , 1 - 3 Months,false
University of Michigan,Social Work Practice: Advocating Social Justice and Change,"[Communication]",48,347,Beginner , Course , 1 - 4 Weeks,false
IESE Business School,Accounting: Principles of Financial Accounting,"[Accounting, Financial Accounting, Finance]",48,29000,Beginner , Course , 1 - 4 Weeks,false
HubSpot Academy,Sales Training for High Performing Teams,"[Sales, Strategy, Customer Relationship Management, Marketing, Communication, Leadership and Management, B2B Sales, Inside Sales, Prospecting and Qualification, Sales Systems, People Analysis, Negotiation, Strategy and Operations, Business Communication, Decision Making, Market Research, Business Process Management]",47,956,Beginner , Specialization , 1 - 3 Months,false
DeepLearningAI,Natural Language Processing with Sequence Models,"[Artificial Neural Networks, Deep Learning, Machine Learning, Natural Language Processing, Statistical Programming, Python Programming]",45,11000,Intermediate , Course , 1 - 4 Weeks,false
Google,Google IT Support (Deutsch),"[Computer Networking, Network Architecture, Network Model, Networking Hardware, Network Security, Operating Systems, System Security, Security Engineering, Theoretical Computer Science, Software Security, Communication, Computer Architecture, Strategy and Operations, Cloud Computing, Linux]",47,187,Beginner , Professional Certificate , 3 - 6 Months,false
The State University of New Yor000,Solar Energy Basics,"[(24k reviews)]",48,24000,Beginner , Course , 1 - 3 Months,false
École Polytechnique Fédérale de Lausanne,Effective Programming in Scala,"[Computer Programming, Scala Programming, Software Testing]",47,148,Intermediate , Course , 1 - 3 Months,false
Universidad de Palermo,Administración de Empresas,"[Strategy, Leadership and Management, Marketing, Organizational Development, Planning, Econometrics, Negotiation, Strategy and Operations, Business Communication, Communication, Decision Making, Probability & Statistics, Process Analysis, Adaptability, Business Intelligence, Collaboration, Persona Research, Probability Distribution, Accounting, Calculus, Change Management, Human Resources, Innovation, Marketing Management, Project Management, Account Management, General Statistics, Marketing Design, Behavioral Economics, Business Process Management, Customer Analysis, Finance, User Experience Design, Business, Professional Development]",48,16000,Beginner , Specialization , 3 - 6 Months,false
IBM,Getting Started with AI using IBM Watson,"[Cloud Computing, Human Computer Interaction, Human Learning, IBM Cloud, Machine Learning, Natural Language Processing, Artificial Neural Networks, Deep Learning, Machine Learning Algorithms, Cloud API]",45,28000,Beginner , Course , 1 - 4 Weeks,false
University of Illinois at Urbana-Champaign,Introduction to Sustainability,"[(25k reviews)]",48,25000,Mixed , Course , 1 - 3 Months,false
University of Pennsylvania,FinTech: Foundations Payments and Regulations,"[FinTech, Finance, Behavioral Economics, BlockChain, Financial Analysis, Financial Management, Market Research, Payments, Risk Management, Cash Management]",46,23000,Beginner , Course , 1 - 4 Weeks,false
Meta,Desarrollador front-end de Meta,"[(71 reviews)]",45,71,Beginner , Professional Certificate , 3 - 6 Months,false
Johns Hopkins University,Data Visualization & Dashboarding with R,"[Data Visualization, R Programming, Statistical Programming, Data Analysis, Data Visualization Software, Computer Programming, Data Structures, Exploratory Data Analysis, Programming Principles, Statistical Visualization]",48,354,Beginner , Specialization , 3 - 6 Months,false
Rice University,Mindfulness and Well-being,"[Emotional Intelligence]",48,973,Beginner , Specialization , 3 - 6 Months,false
Aptly,Marketing with TikTo000,"[Marketing, Social Media, Digital Marketing, Media Strategy & Planning, Advertising Sales, Media Production, E-Commerce, Sales, Strategy, Market Analysis]",47,91,Beginner , Specialization , 1 - 3 Months,false
HEC Paris,Business Model Innovation,"[Business Design, Entrepreneurship, Strategy, Strategy and Operations, Innovation, Leadership and Management, Marketing, Business Analysis, Research and Design, Sales]",48,532,Mixed , Course , 1 - 3 Months,false
Google,Gestion de projet de Google,"[Business Analysis, Business Development, Communication, Decision Making, Design and Product, Entrepreneurship, Leadership and Management, Planning, Strategy, Strategy and Operations, Data Analysis, Business Psychology, Conflict Management, Emotional Intelligence, People Management, Resilience, C++ Programming, Compensation, HR Tech, Network Security, Business Design, Employee Relations, Scrum (Software Development)]",45,21,Beginner , Professional Certificate , 3 - 6 Months,false
IBM,Introduction to Hardware and Operating Systems,"[Operating Systems, Computer Networking, IBM Cloud]",48,877,Beginner , Course , 1 - 3 Months,false
Yale University,Addiction Treatment: Clinical Skills for Healthcare Providers,"[(17k reviews)]",48,17000,Beginner , Course , 1 - 3 Months,false
Autodesk,Autodesk Certified Professional: Revit for Architectural Design Exam Prep,"[(919 reviews)]",47,919,Advanced , Course , 1 - 4 Weeks,false
Duke University,Data Science Math Skills,"[Data Analysis, General Statistics, Probability & Statistics, Problem Solving, Statistical Analysis, Applied Mathematics, Calculus, Critical Thinking]",45,114000,Beginner , Course , 1 - 3 Months,false
Georgia Institute of Technology,Introduction to Engineering Mechanics,"[(48k reviews)]",48,48000,Mixed , Course , 1 - 3 Months,false
University of Geneva,Precision Medicine,"[(227 reviews)]",44,227,Intermediate , Course , 1 - 3 Months,false
Arm,Arm Cortex-M Architecture and Software Development,"[(86 reviews)]",47,86,Intermediate , Specialization , 3 - 6 Months,false
University of California San Diego,Biology Meets Programming: Bioinformatics for Beginners,"[Bioinformatics, Computational Thinking, Problem Solving, Biostatistics, Computational Logic, Critical Thinking]",42,15000,Beginner , Course , 1 - 4 Weeks,false
University of Toronto,The Arts and Science of Relationships: Understanding Human Needs,"[Emotional Intelligence, Communication]",45,16000,Beginner , Course , 1 - 3 Months,false
University of Pennsylvania,Introduction to Operations Management,"[Leadership and Management, Operations Management]",44,26000,Beginner , Course , 1 - 4 Weeks,false
IBM,Generative AI: Introduction and Applications,"[(14 reviews)]",46,14,Beginner , Course , 1 - 4 Weeks,false
Akamai Technologies Inc,Akamai Customer Consulting and Support,"[Computer Security Incident Management, Mobile Security, Network Architecture, Network Security, Operations Management, Risk Management]",49,27,Beginner , Professional Certificate , 3 - 6 Months,false
Akamai Technologies Inc,Akamai Network Engineering,"[Computer Security Incident Management, Mobile Security, Network Architecture, Network Security, Operations Management, Risk Management]",49,27,Beginner , Professional Certificate , 3 - 6 Months,false
Rice University,Introduction to Scripting in Python,"[Computer Programming, Programming Principles, Python Programming, Computer Programming Tools, Computational Logic, Data Analysis, Computational Thinking, Mathematics, Algorithms, Critical Thinking, Data Structures, Mathematical Theory & Analysis, Problem Solving, Algebra, Data Visualization]",47,42000,Beginner , Specialization , 3 - 6 Months,false
Georgia Institute of Technology,Linear Circuits 1: DC Analysis,"[(14k reviews)]",45,14000,Mixed , Course , 1 - 3 Months,false
University of Washington,Computational Neuroscience,"[Mathematics, Computer Programming, Mathematical Theory & Analysis, Probability & Statistics, Python Programming, Computational Logic, Data Analysis, Artificial Neural Networks, Linear Algebra, Machine Learning, Human Learning]",46,1000,Beginner , Course , 1 - 3 Months,false
UNSW Sydney (The University of New South Wales),Introduction to Systems Engineering,"[Systems Design, Leadership and Management]",47,737,Mixed , Course , 1 - 3 Months,false
University of California Davis,Wine Tasting: Sensory Techniques for Wine Analysis,"[(496 reviews)]",47,496,Beginner , Course , 1 - 3 Months,false
Arizona State University,Battery Technologies,"[(33 reviews)]",47,33,Beginner , Specialization , 3 - 6 Months,false
The Pennsylvania State University,Creativity Innovation and Transformation,"[Creativity, Critical Thinking, Leadership and Management]",45,640,Mixed , Course , 1 - 4 Weeks,false
Parsons School of Design,Healthier Materials and Sustainable Building,"[(10 reviews)]",50,10,Intermediate , Specialization , 1 - 3 Months,false
IBM,Developing AI Applications with Python and Flas000,"[Application Development, Computer Programming, Python Programming]",44,515,Intermediate , Course , 1 - 4 Weeks,false
University of Michigan,Python Project: pillow tesseract and opencv,"[Computer Programming, Python Programming]",40,19000,Intermediate , Course , 1 - 4 Weeks,false
Vanderbilt University,Android App Development,"[Mobile Development, Android Development, Computer Programming, Java Programming, Programming Principles, Application Development, Mobile Development Tools, Computer Programming Tools, Software Engineering, Data Structures, Problem Solving]",45,36000,Beginner , Specialization , 3 - 6 Months,false
University of Michigan,Inspiring and Motivating Individuals,"[Human Resources, Communication, Leadership Development, Leadership and Management]",48,54000,Beginner , Course , 1 - 4 Weeks,false
Emory University,Weight Management: Beyond Balancing Calories,"[Leadership and Management]",47,11000,Beginner , Course , 1 - 3 Months,false
Duke University,Spark Hadoop and Snowflake for Data Engineering,"[Big Data, Data Warehousing, Python Programming]",0,0,Advanced , Course , 1 - 4 Weeks,false
Yale University,Everyday Parenting: The ABCs of Child Rearing,"[(28k reviews)]",49,28000,Beginner , Course , 1 - 4 Weeks,false
Tecnológico de Monterrey,Diseño Instruccional: Aprendizaje activo y Pedagogía digital,"[Innovation, Critical Thinking, Planning]",47,972,Beginner , Specialization , 3 - 6 Months,false
University of Michigan,Financial Technology (Fintech) Innovations,"[FinTech, Finance, BlockChain, Decision Making, Risk Management, Financial Analysis, Investment Management, Leadership and Management, Critical Thinking, Data Analysis, Innovation, Machine Learning, Algorithms, Entrepreneurship, Strategy, Cryptography, Data Mining, Payments, Strategy and Operations, Cyberattacks, Network Security, Probability & Statistics, Statistical Machine Learning, Computer Programming]",47,24000,Beginner , Specialization , 3 - 6 Months,false
PwC,Data-driven Decision Making,"[Big Data, Business Analysis, Data Analysis, Data Management, Data Visualization, Decision Making, Business Process Management, Critical Thinking, Customer Analysis, Exploratory Data Analysis]",46,6000,Beginner , Course , 1 - 4 Weeks,false
Michigan State University,Write A Feature Length Screenplay For Film Or Television,"[Writing]",46,192,Beginner , Course , 3 - 6 Months,false
Arizona State University,Teach English Now! Foundational Principles,"[Mergers & Acquisitions]",49,139000,Mixed , Course , 1 - 3 Months,false
Meta,Introduction to Back-End Development,"[HTML and CSS, React (web framework), Web Development, Front-End Web Development, Web Design, Web Development Tools]",48,26000,Beginner , Course , 1 - 4 Weeks,false
California Institute of the Arts,Visual Elements of User Interface Design,"[Design and Product, Front-End Web Development, Interactive Design, User Experience, User Experience Design, Visual Design, Visualization (Computer Graphics), Web Design]",47,58000,Beginner , Course , 1 - 3 Months,false
MedCerts,Medical Terminology and the Human Body Fundamentals,"[(32 reviews)]",48,32,Beginner , Course , 1 - 4 Weeks,false
DeepLearningAI,Generative AI for Everyone,"[Course]",0,0,Course,0,0,false
Microsoft,Introduction to Microsoft Azure Cloud Services,"[Cloud Applications, Cloud Computing, Cloud Infrastructure, Microsoft Azure, Cloud Management, Cloud Platforms, Cloud Standards, Cloud-Based Integration, Software As A Service, Account Management, Cloud Storage, Databases]",46,18000,Beginner , Course , 1 - 4 Weeks,false
Duke University,Introduction to Logic and Critical Thinking,"[Critical Thinking, Human Learning]",46,33000,Beginner , Specialization , 3 - 6 Months,false
The State University of New Yor000,Foundations for Assisting in Home Care,"[(361 reviews)]",48,361,Mixed , Course , 3 - 6 Months,false
Northwestern University,Social Media Marketing,"[Marketing, Social Media, Communication, Digital Marketing, Media Strategy & Planning, Market Research, Strategy, Marketing Management, Brand Management, Advertising, Entrepreneurship, Decision Making, Market Analysis, Research and Design, Customer Success, People Management]",46,53000,Beginner , Specialization , 3 - 6 Months,false
Autodesk,CAD and Digital Manufacturing,"[Design and Product, Product Design, Feature Engineering, Computer Graphics, Interactive Design, Computer Graphic Techniques, Graphics Software, Research and Design, Software Engineering Tools, Graphic Design, Visualization (Computer Graphics), Hardware Design, Product Development, Visual Design, Geometry, User Experience Design, Strategy and Operations, Communication, Decision Making, Product Management, System Software, Collaboration, Computer Programming, Other Cloud Platforms and Tools]",47,5000,Intermediate , Specialization , 3 - 6 Months,false
University of Illinois at Urbana-Champaign,Federal Taxation I: Individuals Employees and Sole Proprietors,"[Accounting, Taxes, Critical Thinking, Finance, Financial Accounting, General Accounting, Problem Solving, Regulations and Compliance, Generally Accepted Accounting Principles (GAAP), Benefits]",49,599,Intermediate , Course , 1 - 3 Months,false
Yale University,Introduction to Medical Software,"[Software Engineering, Software Testing, Entrepreneurship, User Research]",48,119,Intermediate , Course , 3 - 6 Months,false
University of Colorado Boulder,Everyday Excel Part 1,"[Business Analysis, Data Analysis, Data Analysis Software, Microsoft Excel, Spreadsheet Software, Critical Thinking, Problem Solving, Data Management, Mathematics, Data Visualization]",47,32000,Beginner , Course , 1 - 3 Months,false
University of Minnesota,User Interface Design,"[Human Computer Interaction, User Experience, Research and Design, User Experience Design, User Research, Design and Product, Interactive Design, People Analysis, Product Design, Software Testing]",46,17000,Intermediate , Specialization , 3 - 6 Months,false
IESE Business School,Strategy and Sustainability,"[Leadership and Management, Strategy, Strategy and Operations, Critical Thinking, Risk Management, Business Analysis, Business Transformation, Decision Making, Regulations and Compliance, Change Management, Planning]",47,471,Beginner , Course , 1 - 3 Months,false
University of Colorado System,C++ Programming for Unreal Game Development,"[Computer Programming, C Programming Language Family, Computer Programming Tools, Programming Principles]",45,159,Intermediate , Specialization , 3 - 6 Months,false
University of Michigan,Sleep: Neurobiology Medicine and Society,"[(714 reviews)]",48,714,Beginner , Course , 1 - 3 Months,false
Columbia University,Introduction to Financial Engineering and Risk Management,"[Finance, Mathematics, Probability & Statistics, Risk Management, Securities Sales, Securities Trading]",46,158,Intermediate , Course , 1 - 3 Months,false
University of Pittsburgh,Clinical Terminology for International and US Students,"[Communication]",48,3000,Beginner , Course , 1 - 3 Months,false
University of Illinois at Urbana-Champaign,Financial Planning for Young Adults,"[Finance, Financial Management, Leadership and Management, Planning, Cash Management, Decision Making, Account Management, Budget Management, Financial Analysis, Risk Management]",46,13000,Beginner , Course , 1 - 3 Months,false
Pontificia Universidad Católica de Chile,English for Common Interactions in the Workplace: Basic Level,"[(13k reviews)]",47,13000,Mixed , Course , 1 - 3 Months,false
Universidad Nacional Autónoma de México,Finanzas corporativas,"[Finance, Business Analysis, Accounting, Data Analysis, Mathematical Theory & Analysis, Mathematics, Account Management, Calculus, Financial Accounting, Financial Analysis, Investment Management, Operational Analysis, Applied Mathematics, Process Analysis, Banking, Behavioral Economics, Microsoft Excel, Business Process Management, Entrepreneurial Finance, Estimation, Financial Management, Leadership and Management, Operations Management, Risk Management, Econometrics]",47,26000,Intermediate , Specialization , 3 - 6 Months,false
Coursera Project Network,Understanding Basic SQL Syntax,"[SQL]",47,84,Beginner , Guided Project , Less Than 2 Hours,false
Nanyang Technological University,Introduction to Forensic Science,"[(22k reviews)]",49,22000,Mixed , Course , 1 - 3 Months,false
University of Minnesota,Software Development Lifecycle,"[Software Engineering, Agile Software Development, Design and Product, Problem Solving, Software Architecture, Software Testing, Leadership and Management, Project Management, Scrum (Software Development), Software Engineering Tools, Continuous Delivery, Product Development, User Experience, Application Development, Communication, Planning, Product Management, Collaboration, Estimation, Computer Programming Tools, System Software, Theoretical Computer Science, Search Engine Optimization, Investment Management]",47,9000,Intermediate , Specialization , 3 - 6 Months,false
MathWorks,Image Processing for Engineering and Science,"[Matlab, Data Visualization, Computer Graphic Techniques, Computer Vision, Scientific Visualization, Visualization (Computer Graphics)]",48,114,Beginner , Specialization , 1 - 3 Months,false
Starweaver,Relationship Management and Business Development,"[Business Development, Customer Relationship Management, Leadership and Management]",46,20,Intermediate , Course , 1 - 4 Weeks,false
