partner,course,skills,rating,reviewcount,level,certificatetype,duration,crediteligibility
University of Pennsylvania,Gamification,"[Game Theory, Critical Thinking, User Experience, Business Psychology, Strategy, User Experience Design, Behavioral Economics, Human Learning, Problem Solving, Research and Design]",48,24000,Mixed , Course , 1 - 3 Months,false
Berklee,Music Education for Teachers,"[Writing]",48,28000,Intermediate , Specialization , 3 - 6 Months,false
Stanford University,Child Nutrition and Cooking,"[(99k reviews)]",48,99000,Beginner , Course , 1 - 3 Months,false
Rice University,Medical Terminology,"[Human Learning, Communication]",49,401,Beginner , Specialization , 3 - 6 Months,false
ISAE-SUPAERO,Fundamentals of Flight mechanics,"[Mathematical Theory & Analysis]",47,345,Beginner , Specialization , 3 - 6 Months,false
University of Michigan,Using Public Policy for Social Change,"[Problem Solving]",50,6,Beginner , Course , 1 - 4 Weeks,false
Google,Google Digital Marketing & E-commerce,"[]",0,0,,0,0,false
INSEAD,Blockchain Revolution,"[BlockChain, Finance, FinTech, Innovation, Cryptography, Strategy and Operations, System Security, Distributed Computing Architecture, Leadership and Management, Contract Management, Entrepreneurship, Internet Of Things, Network Model, Network Security, Regulations and Compliance, Research and Design, Strategy, Human Resources, Software Security, Recruitment]",47,29000,Beginner , Specialization , 3 - 6 Months,false
Autodesk,Autodesk CAD/CAM/CAE for Mechanical Engineering,"[(48k reviews)]",48,48000,Intermediate , Specialization , 3 - 6 Months,false
DeepLearningAI,TensorFlow: Data and Deployment,"[Machine Learning, Applied Machine Learning, Deep Learning, Tensorflow, Computer Programming, Javascript, Artificial Neural Networks, Python Programming, Data Model, Machine Learning Algorithms, Machine Learning Software, Mobile Development, Web Development, Computer Vision, Mobile Development Tools, Extract, Transform, Load, Human Learning, Network Model, iOS Development]",46,14000,Intermediate , Specialization , 3 - 6 Months,false
IBM,Exploratory Data Analysis for Machine Learning,"[Data Analysis, Exploratory Data Analysis, Machine Learning, Statistical Machine Learning, Feature Engineering, General Statistics, Probability & Statistics, Statistical Analysis, Algorithms, Data Structures]",46,14000,Intermediate , Course , 1 - 3 Months,false
Codio,Programming in C++: A Hands-on Introduction,"[Computer Programming, Computer Science, Problem Solving]",46,921,Beginner , Specialization , 3 - 6 Months,false
University of Pennsylvania,Introduction to Corporate Finance,"[Accounting, Budget Management, Finance, General Accounting, Business Analysis, Data Analysis, Decision Making, Entrepreneurship, Mathematical Theory & Analysis, Strategy and Operations]",46,58000,Mixed , Course , 1 - 4 Weeks,false
University of Colorado System,Agile Leadership,"[Leadership and Management, Business Psychology, Entrepreneurship, Communication, Strategy and Operations, Leadership Development, Change Management, Organizational Development, Project Management, Adaptability, Collaboration, Emotional Intelligence, Human Resources, Resilience, Business Transformation, Strategy, Business Communication, Professional Development, Scrum (Software Development)]",48,22000,Beginner , Specialization , 3 - 6 Months,false
Google,تحليلات البيانات من Google,"[Computer Programming, Problem Solving, Python Programming, Programming Principles, Computer Programming Tools, Algebra, Computational Thinking, Exploratory Data Analysis, Mathematics, Data Analysis, Process Analysis, Differential Equations, Theoretical Computer Science, Critical Thinking, Data Analysis Software, Data Visualization, Databases, Decision Making, People Analysis, SQL, Communication]",48,162,Beginner , Professional Certificate , 3 - 6 Months,false
New York University,Introduction to Cyber Security,"[Security Engineering, Cyberattacks, Network Security, System Security, Security Strategy, Computer Networking, Security Software, Computer Security Models, Network Architecture, Strategy, Cryptography, Problem Solving, Software Security, Algorithms, Computer Security Incident Management, Critical Thinking, Operational Analysis, Computational Thinking, BlockChain, Cloud Computing, Mobile Security]",47,34000,Beginner , Specialization , 3 - 6 Months,false
Google,Google Data Analytics (DE),"[Design and Product, Data Analysis, Software Engineering, Microsoft Excel, Business Analysis, Computer Programming, SQL]",44,28,Beginner , Professional Certificate , 3 - 6 Months,false
The Hong Kong University of Science and Technology,Python and Statistics for Financial Analysis,"[Basic Descriptive Statistics, Computer Programming, Data Analysis, Finance, Financial Analysis, Probability & Statistics, Python Programming, Statistical Analysis, Data Analysis Software, General Statistics, Probability Distribution]",44,39000,Intermediate , Course , 1 - 4 Weeks,false
The University of Edinburgh,Introduction to Philosophy,"[(9k reviews)]",47,9000,Mixed , Course , 3 - 6 Months,false
DeepLearningAI,Natural Language Processing with Probabilistic Models,"[Machine Learning, Natural Language Processing, Python Programming, Statistical Programming, Statistical Machine Learning]",47,16000,Intermediate , Course , 1 - 4 Weeks,false
Columbia University,Economics of Money and Banking,"[Banking, Finance]",49,15000,Mixed , Course , 3 - 6 Months,false
Google,Design a User Experience for Social Good & Prepare for Jobs,"[User Experience, Social Media, User Research, Web Design]",48,29000,Beginner , Course , 1 - 3 Months,false
Google,Fundamentos de la gestión de proyectos,"[Leadership and Management, Organizational Development, Planning, Project Management, Strategy, Strategy and Operations, Change Management, Communication, Adaptability, Business Communication]",49,48000,Beginner , Course , 1 - 4 Weeks,false
DeepLearningAI,Sequences Time Series and Prediction,"[Machine Learning, Forecasting, Tensorflow, Applied Machine Learning, Deep Learning, Artificial Neural Networks, Human Learning, Data Visualization, Statistical Analysis, Statistical Machine Learning]",47,49000,Intermediate , Course , 1 - 4 Weeks,false
University of London,The Manager's Toolkit: A Practical Guide to Managing People at Wor000,"[Human Resources, Leadership and Management, People Management, Conflict Management, Decision Making, Human Resources Operations, People Analysis, Performance Management, Recruitment, Business Analysis, Employee Relations, Leadership Development, Organizational Development, People Development]",47,36000,Mixed , Course , 1 - 3 Months,false
University System of Georgia,Managing Cybersecurity,"[Security Engineering, System Security, Risk Management, Computer Security Incident Management, Leadership and Management, Security Strategy, Network Security, Strategy, Cyberattacks, Strategy and Operations, Computer Security Models, Software Security, Security Software, Computer Networking, Planning, Regulations and Compliance, Business Analysis, Network Architecture, Networking Hardware, Operations Management, Cryptography, Network Model, Systems Design]",48,1000,Beginner , Specialization , 3 - 6 Months,false
University of Michigan,Python Data Structures,"[Algorithms, Computational Logic, Computer Programming, Computer Programming Tools, Critical Thinking, Data Management, Data Structures, Problem Solving, Python Programming, Software Engineering]",49,94000,Beginner , Course , 1 - 3 Months,false
Cisco Learning and Certifications,Cybersecurity Operations Fundamentals,"[Operations Management]",48,123,Beginner , Specialization , 3 - 6 Months,false
DeepLearningAI,Build Basic Generative Adversarial Networks (GANs),"[Artificial Neural Networks, Machine Learning, Machine Learning Algorithms, Machine Learning Software, Python Programming, Statistical Programming, Deep Learning]",47,18000,Intermediate , Course , 1 - 4 Weeks,false
Microsoft,Microsoft Azure Data Fundamentals DP-900 Exam Prep,"[Data Management, Databases, Microsoft Azure, Cloud Computing, SQL, Big Data, Data Analysis, Database Application, Data Architecture, Data Warehousing, Cloud Storage, Data Structures, Data Visualization, Extract, Transform, Load, Leadership and Management, NoSQL, Data Analysis Software, Data Visualization Software, Database Administration, Cloud Infrastructure, Cloud Management, Database Theory, PostgreSQL]",47,549,Beginner , Specialization , 3 - 6 Months,false
ESSEC Business School,Reporting extra-financier et stratégie RSE,"[Strategy, Audit, Strategy and Operations, Change Management, Communication, Finance, Leadership and Management, Regulations and Compliance]",47,370,Beginner , Course , 1 - 4 Weeks,false
IBM,Introduction to DevOps,"[DevOps, Continuous Delivery, Continuous Integration, Software Engineering]",48,21000,Beginner , Course , 1 - 3 Months,false
Yonsei University,International Marketing & Cross Industry Growth,"[Marketing, Strategy, Leadership and Management, Customer Analysis, Market Analysis, Marketing Management, Product Marketing, Brand Management, Customer Relationship Management, Marketing Design, Media Strategy & Planning, Product Strategy, Product Management, Decision Making, Strategy and Operations, B2B Sales, Business Development, Social Media, Communication, Creativity, Operations Management, Sales, Performance Management, Reinforcement Learning]",47,22000,Beginner , Specialization , 3 - 6 Months,false
University of Pennsylvania,Computational Thinking for Problem Solving,"[Computational Thinking, Computer Programming, Problem Solving, Algorithms, Computational Logic, Critical Thinking, Programming Principles, Python Programming, Theoretical Computer Science, Computer Programming Tools]",47,13000,Beginner , Course , 1 - 4 Weeks,false
Johns Hopkins University,Algebra: Elementary to Advanced,"[Algebra, Mathematics, Problem Solving, Linear Algebra, Applied Mathematics, Critical Thinking, Plot (Graphics), Mathematical Theory & Analysis, Computational Thinking, Decision Making]",48,500,Beginner , Specialization , 3 - 6 Months,false
University of Pennsylvania,Culture-Driven Team Building,"[Leadership and Management, Collaboration, Communication, Business Psychology, Emotional Intelligence, Entrepreneurship, Culture, People Management, Strategy and Operations, Professional Development, Conflict Management, Organizational Development, Human Learning]",46,894,Beginner , Specialization , 3 - 6 Months,false
Duke University,Python Programming Fundamentals,"[Algorithms, Computer Programming, Problem Solving, Python Programming]",44,7,Beginner , Course , 1 - 4 Weeks,false
Berklee,Music Business,"[Critical Thinking, Creativity, Regulations and Compliance, Strategy, Decision Making, Problem Solving, Process Analysis, Communication, Leadership and Management, Brand Management, Entrepreneurship, Planning, Writing, Business Analysis, Deep Learning, Marketing, Social Media, Innovation]",48,32000,Beginner , Specialization , 3 - 6 Months,false
École Polytechnique Fédérale de Lausanne,Functional Programming in Scala,"[Computer Programming, Programming Principles, Scala Programming, Theoretical Computer Science, Computational Thinking, Critical Thinking, Data Structures, Big Data, Algorithms, Apache, SQL]",47,106000,Intermediate , Specialization , 3 - 6 Months,false
Google Cloud,Organizational Change and Culture for Adopting Google Cloud,"[Cloud Computing, Leadership and Management, Strategy and Operations, Business Transformation, DevOps, Innovation, Cloud-Based Integration, Collaboration, Google Cloud Platform, Strategy, Cloud Platforms, Communication, Product Development, Business Analysis, Change Management, Cloud Applications, Cloud Clients, Cloud Infrastructure, Design and Product, Kubernetes, Organizational Development, Other Cloud Platforms and Tools, Business Intelligence, Customer Analysis, Data Analysis, Entrepreneurship, Product Management, Google App Engine, Software Engineering Tools, Research and Design, Culture]",47,35000,Beginner , Specialization , 3 - 6 Months,false
University of California Davis,Professional Skills for the Workplace,"[Leadership and Management, Communication, Emotional Intelligence, Professional Development, Collaboration, Problem Solving, Critical Thinking, People Development, Business Psychology, Strategy and Operations, Adaptability, People Analysis, Strategy, Resilience, Entrepreneurship, Planning]",48,24000,Beginner , Specialization , 3 - 6 Months,false
Rice University,Fundamentals of Immunology,"[(21k reviews)]",47,21000,Intermediate , Specialization , 3 - 6 Months,false
University of Colorado Boulder,Introduction to Public Relations and the Media,"[Communication, Public Relations, Media Strategy & Planning, Strategy, Brand Management, Leadership and Management, Marketing, Strategy and Operations, Planning, Social Media, Critical Thinking, Customer Relationship Management, Journalism]",47,360,Beginner , Specialization , 3 - 6 Months,false
The Hong Kong University of Science and Technology,Information Systems Auditing Controls and Assurance,"[Security Engineering, Strategy and Operations, Change Management, Audit, Leadership and Management, Risk Management]",47,32000,Beginner , Course , 1 - 4 Weeks,false
SAP,SAP Professional Fundamentals,"[Leadership and Management, Strategy, Strategy and Operations, Business Process Management, Planning, Project Management, Business Analysis, Business Transformation, Cloud-Based Integration, Product Management, Supply Chain and Logistics]",47,366,Beginner , Course , 1 - 3 Months,false
University of Michigan,Python Functions Files and Dictionaries,"[Python Programming, Computer Programming]",49,51000,Beginner , Course , 1 - 3 Months,false
University of Colorado Boulder,Finance for Technical Managers,"[Finance, Financial Analysis, Accounting, Investment Management, Cost Accounting, Leadership and Management, Financial Accounting, Financial Management, Strategy and Operations]",47,87,Beginner , Specialization , 3 - 6 Months,false
Duke University,Electric Industry Operations and Markets,"[Operations Management, Strategy and Operations, Operational Analysis, Market Analysis, Supply Chain Systems, Operating Systems, Planning, Strategy, Systems Design, Transportation Operations Management]",48,12000,Beginner , Course , 1 - 4 Weeks,false
ESSEC Business School,Hotel Management: Distribution Revenue and Demand Management,"[Business Analysis, Leadership and Management, Strategy and Operations, Market Analysis, Marketing, Strategy, Business Process Management, Forecasting, Media Strategy & Planning, Operations Management, Performance Management]",46,2000,Beginner , Specialization , 3 - 6 Months,false
Yale University,The Science of Well-Being for Teens,"[(367 reviews)]",49,367,Beginner , Course , 1 - 3 Months,false
Google,Google Data Analytics,"[]",0,0,,0,0,false
Duke University,Entrepreneurial Finance: Strategy and Innovation,"[Finance, Entrepreneurial Finance, Risk Management, Probability & Statistics, R Programming, Entrepreneurship, Data Analysis, Investment Management, Statistical Analysis, Statistical Programming, Financial Analysis, Leadership and Management, BlockChain, Cryptography, FinTech, Statistical Tests, Financial Management, Algorithms, Innovation, System Security, Microsoft Excel]",45,13000,Intermediate , Specialization , 3 - 6 Months,false
Wesleyan University,Abnormal Psychology,"[(433 reviews)]",48,433,Beginner , Specialization , 3 - 6 Months,false
University of California Davis,Fundraising and Development,"[Planning, Strategy, Communication, Marketing, Leadership and Management, Organizational Development, Prospecting and Qualification, Strategy and Operations, Decision Making, People Development, Business Development, Taxes, Writing]",46,308,Beginner , Specialization , 3 - 6 Months,false
Rice University,Finance for Non-Finance Professionals,"[Accounting, Business Analysis, Data Analysis, Finance, Financial Analysis, Financial Management, Financial Accounting, Investment Management, Budget Management]",48,26000,Beginner , Course , 1 - 3 Months,false
Johns Hopkins University,GPU Programming,"[Python Programming, Machine Learning, Computer Programming, Artificial Neural Networks, C Programming Language Family, C++ Programming, Algorithms, Data Science, Linear Algebra]",28,66,Intermediate , Specialization , 3 - 6 Months,false
École Polytechnique,Étudier en France: French Intermediate course B1-B2,"[Communication, Culture, Writing]",48,46000,Intermediate , Course , 1 - 3 Months,false
Rice University,Engineering Project Management,"[Leadership and Management, Project Management, Strategy and Operations, Planning, Operations Management, Strategy, Critical Thinking, Decision Making, Performance Management, Risk Management, Organizational Development, Leadership Development, People Management, Business Process Management, Change Management, Conflict Management, Estimation]",47,42000,Beginner , Specialization , 3 - 6 Months,false
UiPath,Robotic Process Automation (RPA),"[Computer Programming, User Experience Design]",47,321,Beginner , Specialization , 3 - 6 Months,false
University of Pennsylvania,ESG Risks and Opportunities,"[Critical Thinking, Investment Management, Leadership and Management, Regulations and Compliance, Risk Management, Strategy, Strategy and Operations, Business Analysis, Business Transformation, Decision Making]",46,524,Beginner , Course , 1 - 4 Weeks,false
Technical University of Denmark (DTU),Wind Energy,"[(71k reviews)]",47,71000,Mixed , Course , 3 - 6 Months,false
DeepLearningAI,Natural Language Processing in TensorFlow,"[Machine Learning, Natural Language Processing, Deep Learning, Machine Learning Algorithms, Tensorflow, Python Programming, Computer Programming, Artificial Neural Networks, Machine Learning Software, Network Model]",46,63000,Intermediate , Course , 1 - 4 Weeks,false
Columbia University,Construction Project Management,"[Project Management, Strategy and Operations, Leadership and Management, Operations Management, Change Management, Entrepreneurship, Planning, Supply Chain and Logistics]",48,63000,Beginner , Course , 1 - 3 Months,false
Duke University,Machine Learning Foundations for Product Managers,"[Machine Learning, Machine Learning Algorithms, Probability & Statistics, Regression, Applied Machine Learning, Data Analysis, Data Mining, Deep Learning, Algorithms, Data Science]",46,261,Beginner , Course , 1 - 3 Months,false
Erasmus University Rotterdam,Principles of Sustainable Finance,"[Finance, Risk Management, Critical Thinking, Financial Management, Leadership and Management, Strategy and Operations, Business Transformation, Decision Making, Financial Analysis, Strategy]",47,15000,Intermediate , Course , 1 - 3 Months,false
University of Virginia,Marketing Analytics,"[Business Analysis, Data Analysis, Market Analysis, Marketing, Brand Management, Customer Analysis, Customer Relationship Management, Strategy, Digital Marketing, Probability & Statistics, Regression]",47,63000,Beginner , Course , 1 - 3 Months,false
Fractal Analytics,Fractal Data Science,"[Communication, Critical Thinking, Data Analysis, Data Model, Exploratory Data Analysis, Feature Engineering, Power BI, Problem Solving, SQL, Storytelling]",39,19,Beginner , Professional Certificate , 3 - 6 Months,false
Meta,Programming with JavaScript,"[Javascript, Front-End Web Development, Computer Programming, Web Development Tools]",47,31000,Beginner , Course , 1 - 3 Months,false
University of California Davis,Coaching Skills for Managers,"[Leadership and Management, Human Resources, Communication, Employee Relations, People Management, Leadership Development, People Development, Performance Management, Professional Development, Organizational Development, Talent Management, Business Psychology, Emotional Intelligence, Problem Solving, Training, People Analysis, Entrepreneurship, Strategy and Operations, Strategy]",48,25000,Intermediate , Specialization , 3 - 6 Months,false
Erasmus University Rotterdam,Driving business towards the Sustainable Development Goals,"[Critical Thinking, Innovation, Leadership and Management, Problem Solving, Strategy, Business Transformation, Collaboration, Entrepreneurship, People Development, Organizational Development]",48,12000,Beginner , Course , 1 - 3 Months,false
University of Pennsylvania,Positive Psychology: Martin E P Seligman’s Visionary Science,"[(57k reviews)]",49,57000,Beginner , Course , 1 - 4 Weeks,false
University of Virginia,Financial Accounting Fundamentals,"[Account Management, Accounting, Accounts Payable and Receivable, Finance, Financial Accounting, Financial Analysis, General Accounting, Generally Accepted Accounting Principles (GAAP), Financial Management, Payments]",48,25000,Beginner , Course , 1 - 3 Months,false
IE Business School,Marketing Strategy,"[Marketing, Market Analysis, Strategy, Marketing Management, Market Research, Product Marketing, Brand Management, Customer Analysis, Media Strategy & Planning, Product Strategy, Strategy and Operations, People Analysis, Decision Making, Behavioral Economics, Customer Success, Process Analysis, Product Management, Data Analysis, Planning, Product Development, Communication]",45,58000,Beginner , Specialization , 3 - 6 Months,false
University of Colorado Boulder,Science of Exercise,"[Health, Training]",48,44000,Beginner , Course , 1 - 4 Weeks,false
IBM,Data Visualization with Python,"[Data Visualization, Python Programming, Statistical Programming, Statistical Visualization, Plot (Graphics), Computer Programming]",45,113000,Intermediate , Course , 1 - 3 Months,false
Berklee,Electronic Music Production,"[(22k reviews)]",48,22000,Intermediate , Specialization , 3 - 6 Months,false
Dartmouth College,C Programming with Linux,"[Computer Programming, Computer Programming Tools, Linux]",46,258,Beginner , Specialization , 3 - 6 Months,false
EC-Council,Cybersecurity Attack and Defense Fundamentals,"[Network Security, Security Engineering, System Security, Computer Networking, Computer Security Incident Management, Software Security, Computer Security Models, Mobile Security, Cyberattacks, Security Software, Internet Of Things, Network Architecture, Cloud Computing, Critical Thinking, Kubernetes, Regulations and Compliance]",46,279,Beginner , Specialization , 3 - 6 Months,false
University of Michigan,Sports Performance Analytics,"[Data Analysis, Python Programming, Statistical Analysis, General Statistics, Probability & Statistics, Statistical Programming, Regression, Exploratory Data Analysis, Statistical Tests, Basic Descriptive Statistics, Correlation And Dependence, Machine Learning Algorithms]",45,206,Intermediate , Specialization , 3 - 6 Months,false
Meta,Marketing en redes sociales de Meta,"[Communication, Marketing, Social Media, Advertising, Marketing Management, Strategy, Media Strategy & Planning, Market Analysis, Strategy and Operations, Leadership and Management, Product Marketing, Brand Management, Marketing Design, Digital Marketing, E-Commerce, Decision Making, Influencing, Public Relations, Planning, User Experience, Budget Management, Business Analysis, Entrepreneurship, Market Research, Statistical Analysis, Emotional Intelligence]",49,885,Beginner , Professional Certificate , 3 - 6 Months,false
Microsoft,Introduction to Computers and Operating Systems and Security,"[Cloud Computing, Computer Architecture, Operating Systems]",48,441,Beginner , Course , 1 - 4 Weeks,false
Universiteit Leiden,Miracles of Human Language: An Introduction to Linguistics,"[(23k reviews)]",47,23000,Beginner , Course , 1 - 3 Months,false
Duke University,Introductory C Programming,"[Python Programming, Computer Programming, C Programming Language Family, Algorithms, Computational Logic, Critical Thinking, Problem Solving, Process Analysis, Programming Principles, Computer Programming Tools, Data Visualization, Theoretical Computer Science, Computational Thinking, Software Testing, Writing, Software Engineering, User Experience]",46,71000,Beginner , Specialization , 3 - 6 Months,false
Stanford University,Antibiotic Stewardship,"[(461 reviews)]",46,461,Advanced , Course , 1 - 3 Months,false
Politecnico di Milano,Artificial Intelligence: an Overview,"[Machine Learning, Leadership and Management, Algorithms, Machine Learning Algorithms, Human Computer Interaction, Human Learning, Regulations and Compliance, Reinforcement Learning, Computational Thinking, Critical Thinking, Strategy, Planning]",45,185,Beginner , Specialization , 3 - 6 Months,false
Meta,Social Media Management,"[Brand Management, Digital Marketing, Marketing, Media Strategy & Planning, Social Media, Strategy and Operations, Advertising, Communication, Creativity, Leadership and Management, Planning]",49,45000,Beginner , Course , 1 - 4 Weeks,false
University of California Irvine,The Pronunciation of American English,"[Communication]",48,963,Beginner , Specialization , 3 - 6 Months,false
University of Pennsylvania,AI Applications in Marketing and Finance,"[Business Analysis, Machine Learning, Customer Analysis, Finance, Financial Accounting, Marketing, Probability & Statistics, Statistical Machine Learning, User Experience]",47,147,Mixed , Course , 1 - 4 Weeks,false
IIMA - IIM Ahmedabad,Pre-MBA Statistics,"[Data Analysis, Data Science, General Statistics]",45,143,Beginner , Course , 1 - 3 Months,false
Duke University,Dog Emotion and Cognition,"[(45k reviews)]",47,45000,Mixed , Course , 1 - 3 Months,false
University of Geneva,Vivre avec le TDAH à travers les âges,"[(70 reviews)]",49,70,Beginner , Course , 1 - 3 Months,false
IBM,Hands-on Introduction to Linux Commands and Shell Scripting,"[Linux]",47,933,Beginner , Course , 1 - 4 Weeks,false
